{
  "name": "devkit-nextjs",
  "version": "0.1.0",
  "description": "Next.js App Router and React server/client boundary conventions",
  "layer": "framework",
  "defaultEnabled": false,
  "dependencies": ["devkit-core", "devkit-frontend", "devkit-react"],
  "paths": {
    "conduct": "./conduct"
  }
}
