{
  "name": "devkit-nuxt",
  "version": "1.1.0",
  "description": "Nuxt conventions: SSR, data-fetching, TypeScript",
  "layer": "framework",
  "defaultEnabled": false,
  "dependencies": [
    "devkit-core",
    "devkit-frontend",
    "devkit-vue"
  ],
  "paths": {
    "skills": "./skills",
    "conduct": "./conduct",
    "mcpServers": "./.mcp.json",
    "hooks": "./hooks/hooks.json"
  }
}
